{
  "schemaVersion": 1,
  "sheets": [
    { "id": "test-character", "image": "sprites/test-character.png", "frameWidth": 128, "frameHeight": 128, "columns": 4, "rows": 3 }
  ],
  "animations": [
    { "id": "idle", "sheetId": "test-character", "frames": [0, 1, 2, 3], "frameDurationMs": 400, "loop": true },
    { "id": "call", "sheetId": "test-character", "frames": [4, 5, 6, 7], "frameDurationMs": 200, "loop": true },
    { "id": "work", "sheetId": "test-character", "frames": [8, 9, 10, 11], "frameDurationMs": 150, "loop": true }
  ],
  "cues": [
    { "id": "resting", "message": "잠깐 쉬고 있어요.", "animationId": "idle" },
    { "id": "calling", "message": "확인할 내용이 있어요!", "animationId": "call" },
    { "id": "working", "message": "작업 중이에요.", "animationId": "work" },
    { "id": "file.work", "message": "파일 작업을 하고 있어요.", "animationId": "work" },
    { "id": "file.work.completed", "message": "파일 작업을 마쳤어요.", "animationId": "call" },
    { "id": "file.work.failed", "message": "작업을 끝내지 못했어요. 작업 기록을 확인해 주세요.", "animationId": "call" },
    { "id": "file.offer", "message": "정리할 파일이 있어요!", "animationId": "call" },
    { "id": "walk.left", "message": "잠깐 산책 중이에요.", "animationId": "idle" },
    { "id": "walk.right", "message": "잠깐 산책 중이에요.", "animationId": "idle" }
  ]
}
